{
  "schema_version": "1.0.0",
  "run_id": "RUN-T4-1785795715034",
  "test_id": "T4",
  "workflow_version": "v0.2.0",
  "prompt_versions": {
    "requirement_extractor": "extractor-v1.0-fragments-speakers-risk-links"
  },
  "result": "needs_review",
  "expected_elements": [
    {
      "description": "Actual output conforms to the extraction schema.",
      "passed": true,
      "evidence": "Schema valid"
    },
    {
      "description": "Extraction status equals complete.",
      "passed": true,
      "evidence": "Actual: 'complete'"
    },
    {
      "description": "All required exact values are preserved.",
      "passed": true,
      "evidence": "All exact values found"
    },
    {
      "description": "All required item types are present.",
      "passed": true,
      "evidence": "Required: ['acceptance_criterion', 'functional_requirement']; actual: ['acceptance_criterion', 'functional_requirement', 'persona']"
    },
    {
      "description": "Every extracted item has verbatim evidence in the source.",
      "passed": true,
      "evidence": "All evidence quotes found in source"
    },
    {
      "description": "Every canonical item has a deterministic actual-item match.",
      "passed": true,
      "evidence": "Mapping: {'FR-001': 'FR-001', 'AC-001': 'AC-001', 'AC-002': 'AC-002'}"
    },
    {
      "description": "Canonical item relationships are preserved after ID mapping.",
      "passed": true,
      "evidence": "Verified 4 directed links"
    },
    {
      "description": "Required contradiction handling is preserved.",
      "passed": true,
      "evidence": "Contradiction expectations satisfied"
    },
    {
      "description": "Required missing-information coverage is present.",
      "passed": true,
      "evidence": "No mandatory gaps"
    },
    {
      "description": "Prohibited literal is absent: additional acceptance criteria",
      "passed": true,
      "evidence": "Absent"
    },
    {
      "description": "Prohibited literal is absent: XLSX",
      "passed": true,
      "evidence": "Absent"
    },
    {
      "description": "Additional actual items require semantic review.",
      "passed": true,
      "evidence": "Additional item IDs: ['PER-001']"
    }
  ],
  "prohibited_behaviors": [],
  "unsupported_claims": [],
  "validation": {
    "schema_valid": true,
    "exact_values_preserved": true,
    "traceability_complete": true
  },
  "observability": {
    "langfuse_trace_id": "25c2d695b6ac970c4d550d8f370bb723",
    "model": "gpt-5.6-terra",
    "latency_ms": 0,
    "input_tokens": 0,
    "output_tokens": 0,
    "estimated_cost_usd": 0
  },
  "reviewer_notes": "Deterministic evaluation generated 2026-08-03T22:26:25.144191+00:00. Token, cost, or latency values remain zero when they were not supplied to this local evaluator."
}
