{
  "schema_version": "1.0.0",
  "run_id": "RUN-T6-1785795782968",
  "test_id": "T6",
  "workflow_version": "v0.2.0",
  "prompt_versions": {
    "requirement_extractor": "extractor-v1.0-fragments-speakers-risk-links"
  },
  "result": "pass",
  "expected_elements": [
    {
      "description": "Actual output conforms to the extraction schema.",
      "passed": true,
      "evidence": "Schema valid"
    },
    {
      "description": "Extraction status equals partial.",
      "passed": true,
      "evidence": "Actual: 'partial'"
    },
    {
      "description": "All required exact values are preserved.",
      "passed": true,
      "evidence": "All exact values found"
    },
    {
      "description": "All required item types are present.",
      "passed": true,
      "evidence": "Required: ['constraint', 'deadline']; actual: ['constraint', 'deadline']"
    },
    {
      "description": "Every extracted item has verbatim evidence in the source.",
      "passed": true,
      "evidence": "All evidence quotes found in source"
    },
    {
      "description": "Every canonical item has a deterministic actual-item match.",
      "passed": true,
      "evidence": "Mapping: {'CON-001': 'CON-001', 'CON-002': 'CON-002', 'DDL-001': 'DDL-001'}"
    },
    {
      "description": "Canonical item relationships are preserved after ID mapping.",
      "passed": true,
      "evidence": "Verified 2 directed links"
    },
    {
      "description": "Required contradiction handling is preserved.",
      "passed": true,
      "evidence": "Contradiction expectations satisfied"
    },
    {
      "description": "Required missing-information coverage is present.",
      "passed": true,
      "evidence": "No mandatory gaps"
    },
    {
      "description": "Prohibited literal is absent: choosing microservices",
      "passed": true,
      "evidence": "Absent"
    },
    {
      "description": "Prohibited literal is absent: choosing single-page app",
      "passed": true,
      "evidence": "Absent"
    }
  ],
  "prohibited_behaviors": [],
  "unsupported_claims": [],
  "validation": {
    "schema_valid": true,
    "exact_values_preserved": true,
    "traceability_complete": true
  },
  "observability": {
    "langfuse_trace_id": "5726e64035e0f1d658ab0f874fbc91b1",
    "model": "gpt-5.6-terra",
    "latency_ms": 0,
    "input_tokens": 0,
    "output_tokens": 0,
    "estimated_cost_usd": 0
  },
  "reviewer_notes": "Deterministic evaluation generated 2026-08-03T22:26:25.147587+00:00. Token, cost, or latency values remain zero when they were not supplied to this local evaluator."
}
