{
  "schema_version": "1.0.0",
  "run_id": "RUN-T8-1785795847803",
  "test_id": "T8",
  "workflow_version": "v0.2.0",
  "prompt_versions": {
    "requirement_extractor": "extractor-v1.0-fragments-speakers-risk-links"
  },
  "result": "fail",
  "expected_elements": [
    {
      "description": "Actual output conforms to the extraction schema.",
      "passed": true,
      "evidence": "Schema valid"
    },
    {
      "description": "Extraction status equals complete.",
      "passed": false,
      "evidence": "Actual: 'partial'"
    },
    {
      "description": "All required exact values are preserved.",
      "passed": true,
      "evidence": "All exact values found"
    },
    {
      "description": "All required item types are present.",
      "passed": true,
      "evidence": "Required: ['functional_requirement', 'persona']; actual: ['functional_requirement', 'persona']"
    },
    {
      "description": "Every extracted item has verbatim evidence in the source.",
      "passed": true,
      "evidence": "All evidence quotes found in source"
    },
    {
      "description": "Every canonical item has a deterministic actual-item match.",
      "passed": true,
      "evidence": "Mapping: {'PER-001': 'PER-001', 'FR-001': 'FR-001', 'PER-002': 'PER-002', 'FR-002': 'FR-002', 'PER-003': 'PER-003', 'FR-003': 'FR-003'}"
    },
    {
      "description": "Canonical item relationships are preserved after ID mapping.",
      "passed": true,
      "evidence": "Verified 6 directed links"
    },
    {
      "description": "Required contradiction handling is preserved.",
      "passed": true,
      "evidence": "Contradiction expectations satisfied"
    },
    {
      "description": "Required missing-information coverage is present.",
      "passed": true,
      "evidence": "No mandatory gaps"
    },
    {
      "description": "Prohibited literal is absent: merging all personas into a generic user",
      "passed": true,
      "evidence": "Absent"
    }
  ],
  "prohibited_behaviors": [],
  "unsupported_claims": [],
  "validation": {
    "schema_valid": true,
    "exact_values_preserved": true,
    "traceability_complete": true
  },
  "observability": {
    "langfuse_trace_id": "ef3cd2ac4a43cc3d41c59956b31f8ddf",
    "model": "gpt-5.6-terra",
    "latency_ms": 0,
    "input_tokens": 0,
    "output_tokens": 0,
    "estimated_cost_usd": 0
  },
  "reviewer_notes": "Deterministic evaluation generated 2026-08-03T22:26:25.150821+00:00. Token, cost, or latency values remain zero when they were not supplied to this local evaluator."
}
