{
  "schema_version": "1.0.0",
  "run_id": "RUN-T2-1785785349585",
  "test_id": "T2",
  "workflow_version": "v0.2.0",
  "prompt_versions": {
    "requirement_extractor": "extractor-v0.8-dependency-risk-fix"
  },
  "result": "fail",
  "expected_elements": [
    {
      "description": "Actual output conforms to the extraction schema.",
      "passed": true,
      "evidence": "Schema valid"
    },
    {
      "description": "Extraction status equals partial.",
      "passed": true,
      "evidence": "Actual: 'partial'"
    },
    {
      "description": "All required exact values are preserved.",
      "passed": true,
      "evidence": "All exact values found"
    },
    {
      "description": "All required item types are present.",
      "passed": false,
      "evidence": "Required: ['functional_requirement']; actual: []"
    },
    {
      "description": "Every extracted item has verbatim evidence in the source.",
      "passed": true,
      "evidence": "All evidence quotes found in source"
    },
    {
      "description": "Every canonical item has a deterministic actual-item match.",
      "passed": false,
      "evidence": "Unmatched: ['FR-001']; mapping: {}"
    },
    {
      "description": "Canonical item relationships are preserved after ID mapping.",
      "passed": true,
      "evidence": "Verified 0 directed links"
    },
    {
      "description": "Required contradiction handling is preserved.",
      "passed": true,
      "evidence": "Contradiction expectations satisfied"
    },
    {
      "description": "Required missing-information coverage is present.",
      "passed": false,
      "evidence": "Not found: metrics, format"
    },
    {
      "description": "Prohibited literal is absent: invented reporting requirements",
      "passed": true,
      "evidence": "Absent"
    },
    {
      "description": "Prohibited literal is absent: invented competitor capabilities",
      "passed": true,
      "evidence": "Absent"
    }
  ],
  "prohibited_behaviors": [],
  "unsupported_claims": [],
  "validation": {
    "schema_valid": true,
    "exact_values_preserved": true,
    "traceability_complete": false
  },
  "observability": {
    "langfuse_trace_id": "26c2b3b387205a095feab2d51694fa50",
    "model": "not-supplied",
    "latency_ms": 0,
    "input_tokens": 0,
    "output_tokens": 0,
    "estimated_cost_usd": 0
  },
  "reviewer_notes": "Deterministic evaluation generated 2026-08-03T20:38:14.253764+00:00. Token, cost, or latency values remain zero when they were not supplied to this local evaluator."
}
